{"policy":{"policies":[{"rules":[{"purposeIris":["urn:aduc:purpose:research"],"actionIri":"http://www.w3.org/ns/odrl/2/use","assignerRef":"urn:example:agent:formatter:assigner","machineEvaluable":true,"effect":"permission","id":"urn:example:rule:formatter:permit"}],"lifecycle":"active","conflict":"clear","status":"canonical","disclosure":"redacted","mode":"open","targetDigest":"bbbbbbbbbbbbbbbbbbbbbbbbbbbbbbbbbbbbbbbbbbbbbbbbbbbbbbbbbbbbbbbb","targetRef":"urn:example:resource:formatter:review:1","id":"urn:example:policy:formatter:review:1"}]},"provenance":{"agents":[{"typeIri":"http://www.w3.org/ns/prov#Organization","id":"urn:example:agent:formatter:assigner"}]},"structure":{"records":[{"fields":[{"required":true,"primitiveType":"string","sourcePath":"$.value","name":"value","id":"urn:example:field:formatter:review:value"}],"sourcePath":"$","name":"row","id":"urn:example:record:formatter:review:row"}],"representation":"record","resourceRef":"urn:example:resource:formatter:review:1","id":"urn:example:structure:formatter:review:1"},"resource":{"version":"1","digest":"bbbbbbbbbbbbbbbbbbbbbbbbbbbbbbbbbbbbbbbbbbbbbbbbbbbbbbbbbbbbbbbb","mediaType":"application/json","kind":"dataset","id":"urn:example:resource:formatter:review:1"},"aduc":{"conformsTo":["urn:aduc:core-model:0.1"],"publisher":"https://example.org/publisher","createdAt":"2026-07-15T10:00:00Z","status":"reviewed","modelVersion":"0.1.0","coreVersion":"0.1.0-alpha.0","contractId":"urn:aduc:contract:formatter:review:1"}}